475,Happy skin pants 14 - pcs,Pampers,"Pampers Baby Dry Pants offers comfort, let your baby's skin breathe easily and provides intense care to their sensitive skin. These will keep your baby smiling and comfortable at all times. Their magic gel layer locks wetness inside and offers upto 12 hours of dryness. ",xyz,1,3,59,1607007117,1607007117
476,Happy skin pants 16 - pcs,Pampers,"Pampers Baby Dry Pants offers comfort, let your baby's skin breathe easily and provides intense care to their sensitive skin. These will keep your baby smiling and comfortable at all times. Their magic gel layer locks wetness inside and offers upto 12 hours of dryness. ",xyz,1,3,59,1607007117,1607007117
477,Happy skin pants 17 - pcs,Pampers,"Pampers Baby Dry Pants offers comfort, let your baby's skin breathe easily and provides intense care to their sensitive skin. These will keep your baby smiling and comfortable at all times. Their magic gel layer locks wetness inside and offers upto 12 hours of dryness. ",xyz,1,3,59,1607007117,1607007117
478,Happy skin pants 20 - pcs,Pampers,"Pampers Baby Dry Pants offers comfort, let your baby's skin breathe easily and provides intense care to their sensitive skin. These will keep your baby smiling and comfortable at all times. Their magic gel layer locks wetness inside and offers upto 12 hours of dryness. ",xyz,1,3,59,1607007117,1607007117
479,Happy skin pants 22 - pcs,Pampers,"Pampers Baby Dry Pants offers comfort, let your baby's skin breathe easily and provides intense care to their sensitive skin. These will keep your baby smiling and comfortable at all times. Their magic gel layer locks wetness inside and offers upto 12 hours of dryness. ",xyz,1,3,59,1607007117,1607007117
480,Happy skin pants 23 - pcs,Pampers,"Pampers Baby Dry Pants offers comfort, let your baby's skin breathe easily and provides intense care to their sensitive skin. These will keep your baby smiling and comfortable at all times. Their magic gel layer locks wetness inside and offers upto 12 hours of dryness. ",xyz,1,3,59,1607007117,1607007117
481,Happy skin pants 24 - pcs,Pampers,"Pampers Baby Dry Pants offers comfort, let your baby's skin breathe easily and provides intense care to their sensitive skin. These will keep your baby smiling and comfortable at all times. Their magic gel layer locks wetness inside and offers upto 12 hours of dryness. ",xyz,1,3,59,1607007117,1607007117
482,Happy skin pants 28 - pcs,Pampers,"Pampers Baby Dry Pants offers comfort, let your baby's skin breathe easily and provides intense care to their sensitive skin. These will keep your baby smiling and comfortable at all times. Their magic gel layer locks wetness inside and offers upto 12 hours of dryness. ",xyz,1,3,59,1607007117,1607007117
483,Happy skin pants 30 - pcs,Pampers,"Pampers Baby Dry Pants offers comfort, let your baby's skin breathe easily and provides intense care to their sensitive skin. These will keep your baby smiling and comfortable at all times. Their magic gel layer locks wetness inside and offers upto 12 hours of dryness. ",xyz,1,3,59,1607007117,1607007117
484,Happy skin pants New Baby 2 pcs UPTO 5 KG,Pampers,"New Pampers baby dry pants style diapers have 3 revolutionary extra absorb channels, that help distribute wetness evenly throughout the pants diapers, so wetness doesn't collect in one place. Their magic gel layer locks wetness inside and offers up to 12 hours of dryness to help your baby sleep soundly all night.",xyz,1,3,59,1607007117,1607007117
485,Happy skin pants New Baby 4 pcs UPTO 5 KG,Pampers,"New Pampers baby dry pants style diapers have 3 revolutionary extra absorb channels, that help distribute wetness evenly throughout the pants diapers, so wetness doesn't collect in one place. Their magic gel layer locks wetness inside and offers up to 12 hours of dryness to help your baby sleep soundly all night.",xyz,1,3,59,1607007117,1607007117
486,Happy skin pants New Baby 9 pcs UPTO 5 KG,Pampers,"New Pampers baby dry pants style diapers have 3 revolutionary extra absorb channels, that help distribute wetness evenly throughout the pants diapers, so wetness doesn't collect in one place. Their magic gel layer locks wetness inside and offers up to 12 hours of dryness to help your baby sleep soundly all night.",xyz,1,3,59,1607007117,1607007117
487,Happy skin pants New Baby 18 pcs,Pampers,"New Pampers baby dry pants style diapers have 3 revolutionary extra absorb channels, that help distribute wetness evenly throughout the pants diapers, so wetness doesn't collect in one place. Their magic gel layer locks wetness inside and offers up to 12 hours of dryness to help your baby sleep soundly all night.",xyz,1,3,59,1607007117,1607007117
488,Happy skin pants New Baby 20 pcs,Pampers,"New Pampers baby dry pants style diapers have 3 revolutionary extra absorb channels, that help distribute wetness evenly throughout the pants diapers, so wetness doesn't collect in one place. Their magic gel layer locks wetness inside and offers up to 12 hours of dryness to help your baby sleep soundly all night.",xyz,1,3,59,1607007117,1607007117
489,Happy skin pants New Baby 22 pcs,Pampers,"New Pampers baby dry pants style diapers have 3 revolutionary extra absorb channels, that help distribute wetness evenly throughout the pants diapers, so wetness doesn't collect in one place. Their magic gel layer locks wetness inside and offers up to 12 hours of dryness to help your baby sleep soundly all night.",xyz,1,3,59,1607007117,1607007117
490,Happy skin pants 42 - pcs,Pampers,"Pampers all round protection pants are the only ANTI RASH Diaper pants in India. Newborn baby diapers containing Lotion with Aloe vera helps protect your baby's delicate skin from diaper rash and irritation. Best diapers with Ultra Absorb Core, provides your baby a new type of dryness overnight - breathable dryness. Magic gel locks wetness away to provide up to 12 hours of dryness.",xyz,1,3,59,1607007117,1607007117
491,Happy skin pants 50 - pcs,Pampers,"Pampers all round protection pants are the only ANTI RASH Diaper pants in India. Newborn baby diapers containing Lotion with Aloe vera helps protect your baby's delicate skin from diaper rash and irritation. Best diapers with Ultra Absorb Core, provides your baby a new type of dryness overnight - breathable dryness. Magic gel locks wetness away to provide up to 12 hours of dryness.",xyz,1,3,59,1607007117,1607007117
492,Happy skin pants 56 - pcs,Pampers,"Pampers all round protection pants are the only ANTI RASH Diaper pants in India. Newborn baby diapers containing Lotion with Aloe vera helps protect your baby's delicate skin from diaper rash and irritation. Best diapers with Ultra Absorb Core, provides your baby a new type of dryness overnight - breathable dryness. Magic gel locks wetness away to provide up to 12 hours of dryness.",xyz,1,3,59,1607007117,1607007117
493,Happy skin pants 58 - pcs,Pampers,"Pampers all round protection pants are the only ANTI RASH Diaper pants in India. Newborn baby diapers containing Lotion with Aloe vera helps protect your baby's delicate skin from diaper rash and irritation. Best diapers with Ultra Absorb Core, provides your baby a new type of dryness overnight - breathable dryness. Magic gel locks wetness away to provide up to 12 hours of dryness.",xyz,1,3,59,1607007117,1607007117
494,Happy skin pants 64 - pcs,Pampers,"Pampers all round protection pants are the only ANTI RASH Diaper pants in India. Newborn baby diapers containing Lotion with Aloe vera helps protect your baby's delicate skin from diaper rash and irritation. Best diapers with Ultra Absorb Core, provides your baby a new type of dryness overnight - breathable dryness. Magic gel locks wetness away to provide up to 12 hours of dryness.",xyz,1,3,59,1607007117,1607007117
495,Baby pants 2 pcs ,Himalaya,About Himalaya Baby total care pants: Powered by natural antirash shield: Indian Aloe and Yashad Bhasma (Zinc Oxide) (that prevent risk of diaper rash) Soft easy-to-fit design offers care and comfort to your baby. silky soft inner layer for soft & sensitive skin Breathable fabric ensures proper air circulation and leakproof soft elastic edges prevent leakage,xyz,1,4,59,1607007117,1607007117
496,Cerelac Wheat Apple Carrot  from  6- 12 months,Cerelac,As your baby grows he/she needs many nutritional complementary foods to help him/her develop faster. This Nestle Cerelac can ensure that your baby gets nearly 75% of his/her daily iron needs with two servings of this baby cereal.,xyz,1,4,60,1607007117,1607007117
497,Cerelac Rice from  6- 12 months,Cerelac,"Nestle CERELAC Baby Cereal with Milk, Rice is a complementary food for babies from 6 to 12 months. While infants and children have higher requirements of nutrients than adults, 2 serves of CERELAC Rice Cereal provides 75% of a baby's daily need of iron. It is also, a source of 19 important nutrients including vitamins and minerals. Nestle develops infant nutrition products backed by evolving science and research. Innovation has been at the heart of Nestle since its beginning. Optimal Preparation: Careful and hygienic preparation of Infant food is most essential for health.",xyz,1,4,60,1607007117,1607007117
498,Cerelac Wheat from  6- 12 months,Cerelac,"CERELAC Organic Selection Wheat Cereal is ideal for babies from 6 to 12 months. This baby cereal is Certified Organic and is made from 100% organic Wheat and Milk. ... Do not use fewer scoops than directed, since diluted feeding will not provide adequate nutrients needed by your infant.",xyz,1,4,60,1607007117,1607007117
499,Cerelac Wheat Apple  from  6- 12 months,Cerelac,"Nestle CERELAC Baby Cereal with Milk, Wheat Apple is a complementary food for babies from 6 to 12 months. While infants and children have higher requirements of nutrients than adults, 2 serves of CERELAC Wheat Apple Cereal provides 75% of a baby's daily need of iron. It is also, a source of 19 important nutrients including vitamins and minerals. Nestle develops infant nutrition products backed by evolving science and research. Innovation has been at the heart of Nestle since its beginning. Optimal Preparation: Careful and hygienic preparation of Infant food is most essential for health.",xyz,1,4,60,1607007117,1607007117
500,Cerelac Wheat Apple Cherry from 8 - 12 months,Cerelac,The Nestle wheat apple cherry baby cereal can be given to your baby (between the age of 8-12 months) as it's a complementary food. Your baby's daily diet of iron can be met up to 75% with 2 servings of this baby cereal. Your child will enjoy the flavour of delicious milk and fruits with this baby cereal.,xyz,1,4,60,1607007117,1607007117
501,Cerelac Wheat Orange from 8 - 12 months,Cerelac,"Nestle CERELAC Fortified Baby Cereal with Milk, Wheat Orange is a complementary food for babies from 8 months onwards. While infants and children have higher requirements of nutrients than adults, 2 serve of CERELAC Wheat Orange Cereal provides 75% of a baby's daily need of iron. Also a source of 19 important nutrients including vitamins and minerals, CERELAC Wheat Orange Cereal is free from added colours, flavours and preservatives. Nestle develops infant nutrition products backed by evolving science and research. Innovation has been at the heart of Nestle since its beginning.",xyz,1,4,60,1607007117,1607007117
502,Cerelac Rice Vegetables from 8 - 12 months,Cerelac,"Nestle CERELAC Baby Cereal with Milk, Rice Vegetables is a complementary food for babies from 8 to 12 months. While infants and children have higher requirements of nutrients than adults, 2 serves of CERELAC Rice Vegetables Cereal provides 75% of a baby's daily need of iron.",xyz,1,4,60,1607007117,1607007117
503,Cerealc Ragi Apple from 8 - 12 months,Cerelac,"Nestle CERELAC Baby Cereal with Milk, Ragi Apple is a complementary food for babies from 8 to 12 months. While infants and children have higher requirements of nutrients than adults, 2 serves of CERELAC Ragi Apple Cereal provides 75% of a baby's daily need of iron. It is also, a source of 19 important nutrients including vitamins and minerals. Nestle develops infant nutrition products backed by evolving science and research. Innovation has been at the heart of Nestle since its beginning.",xyz,1,4,60,1607007117,1607007117
504,Cerelac Wheat Rice Mixed Fruit from 10-12 months,Cerelac,"Nestle CERELAC Baby Cereal with Milk, Wheat-Rice Mixed Fruit is a complementary food for babies from 10 to 12 months. ... Do not use fewer scoops than directed, since diluted feeding will not provide adequate nutrients needed by your infant.",xyz,1,4,60,1607007117,1607007117
505,Cerelac Wheat Rice Mixed Veg from 10-12 months,Cerelac,"Nestle CERELAC Baby Cereal with Milk, Wheat-Rice Mixed Veg is a complementary food for babies from 10 to 12 months. While infants and children have higher requirements of nutrients than adults, 2 serves of CERELAC Wheat-Rice Mixed Veg Cereal provides 99% of a baby's daily need of iron. It is also, a source of 19 important nutrients including vitamins and minerals. Nestle develops infant nutrition products backed by evolving science and research. Innovation has been at the heart of Nestle since its beginning.",xyz,1,4,60,1607007117,1607007117
506,Cerelac Wheat Rice Honey Dates from 10-12 months,Cerelac,"Nestle CERELAC Fortified Baby Cereal with Milk, Wheat Honey Dates is a complementary food for babies from 10 months onwards. While infants and children have higher requirements of nutrients than adults, 2 serve (1 serve=33g Cereal Powder+100ml water) of CERELAC Wheat Honey Dates Cereal provides 99% of a baby's daily need of iron. Also a source of 19 nutrients including vitamins and minerals, CERELAC Wheat Honey Dates Cereal is free from added colours, flavours and preservatives.",xyz,1,4,60,1607007117,1607007117
507,Cerelac Multigrain & Fruits from 12 - 24 months,Cerelac,"Nestle CERELAC Fortified Baby Cereal with Milk, Multigrain & Fruits is a complementary food for babies from 12 months onwards. While infants and children have higher requirements of nutrients than adults, 2 serves of CERELAC Multigrain & Fruits Cereal provides 55% of a baby's daily need of iron. Also a source of 17 important nutrients including vitamins and minerals, CERELAC Multigrain & Fruits Cereal is free from added colours, flavours and preservatives. Nestle develops infant nutrition products backed by evolving science and research. Innovation has been at the heart of Nestle since its beginning.",xyz,1,4,60,1607007117,1607007117
508,Cerelac Multigrain Dal & Veg from 12 - 24 months,Cerelac,Multigrain dal veg baby cereal: Rich in Iron baby cereal for babies from 12 to 24 months.Essentail nutrients for growth: A source of 16 important nutrients including vitamins and minerals.,xyz,1,4,60,1607007117,1607007117
509,Cerelac 5 grains & frutis 18 - 24 months,Cerelac,"
Your baby could be a very fussy eater especially if he/she is busy exploring the world around him/her. The Nestle CERELAC Baby Cereal is designed for all such Doras of the world. ",xyz,1,4,60,1607007117,1607007117
510,Lactogen 1 whey protein & Lactose,Lactogen,A spray dried Infant Formula with Probiotic (L.reuteri) for infants from birth when they are not breastfed,xyz,1,4,60,1607007117,1607007117
511,Lactogen 2 from 6 - 12 months,Lactogen,Nestle LACTOGEN 2 is a spray dried Follow-up Formula for infants after 6 months when they are not breastfed. Babies that receive the right nutrition in the first two years of life are much more likely to benefit from good health through childhood and adulthood.,xyz,1,4,60,1607007117,1607007117
512,Lactogen 3 After 12 months,Lactogen,"Nestle LACTOGEN 3 is a spray dried Follow-up Formula for older infants after 12 months when they are not breastfed. Babies that receive the right nutrition in the first two years of life are much more likely to benefit from good health through childhood and adulthood. Optimal Preparation: Careful and hygienic preparation of Infant food is most essential for health. Do not use fewer scoops than directed, since diluted feeding will not provide adequate nutrients needed by your infant. Do not use more scoops than directed since concentrated feed will not provide the water needed by your infant. ",xyz,1,4,60,1607007117,1607007117
513,Lactogen 4 After 18 months,Lactogen,A spray dried Follow-Up Formula for older infants after 18 months upto 24 months when they are not breastfed,xyz,1,4,60,1607007117,1607007117
514,Whisper Choice Ultra,Whisper,Whisper choice sanitary pads helps you get up to 100 percent stain protection. This revolutionary pad has wings which keep the pad in place. Don't worry about stains and be unstoppable. Kadam badhaye jaa.,xyz,1,1,45,1607007117,1607007117
515,Whisper Ultra soft Air Fresh,Whisper,Whisper Ultra Soft Air fresh gives you airy freshness for irritation free feel. It has 500 air fresh pores for an airy feel on skin. Dermatologically tested.,xyz,1,1,45,1607007117,1607007117
516,Whisper Ultra soft Air Fresh XL,Whisper,Whisper Ultra Soft Air fresh gives you airy freshness for irritation free feel. It has 500 air fresh pores for an airy feel on skin. Dermatologically tested.,xyz,1,1,45,1607007117,1607007117
517,Whisper Choice Clean,Whisper,"It's about living your life by your own rules despite what society says. It's about choosing for yourself, every day of the month. This revolutionary product whisper ultra clean xl+ has odour lock gel that locks upto 100% wetness and even odours and gives you the freedom to live life by your own rules, even during periods. Because meri life, mere rules.",xyz,1,1,45,1607007117,1607007117
518,Whisper Choice Aloe Cottony Soft,Whisper,It's about waking up happy. It's about loving life and loving yourself as much as you do others. It's about continuing to be unstoppable and feeling great at any age. It's about being confident every day of the month. This revolutionary Whisper Ultra Overnight Sanitary Pads XL Wings specially designed for Overnight usage with Longer length* and Wide back for protection against back leaks which LASTS ALL NIGHT LONG.Kadam Badhaye Jaa,xyz,1,1,45,1607007117,1607007117
519,Whisper Maxi Fit,Whisper,"Who doesn't love a perfect fit? Be it your clothes, your shoes or even your pad. Whisper understands that perfectly well and has designed the Maxi Fit range of pads keeping your delicate contours in mind.",xyz,1,1,45,1607007117,1607007117
520,Whisper Ultra nights,Whisper,"It's about living your life by your own rules despite what society says. It's about choosing for yourself, every day of the month. This revolutionary product whisper ultra clean xl+ has odour lock gel that locks upto 100% wetness and even odours and gives you the freedom to live life by your own rules, even during periods. Because meri life, mere rules.",xyz,1,1,45,1607007117,1607007117
521,Whisper Ultra nights XXL+,Whisper,"It's about waking up happy. It's about living your life by your own rules. It's about continuing to be unstoppable and feeling great at any age. It's about being confident every day of the month. This revolutionary sanitary pads specially designed for overnight usage with longer length and wide back for protection against back leaks which lasts all night long. Meri life, mere rules.",xyz,1,1,45,1607007117,1607007117
522,Whisper Ultra nights XXXL+,Whisper,It's about waking up happy. It's about loving life and loving yourself as much as you do others. It's about continuing to be unstoppable and feeling great at any age. It's about being confident every day of the month. This revolutionary sanitary pads specially designed for overnight usage with longer length and wide back for protection against back leaks which lasts all night long. Kadam badhaye jaa.,xyz,1,1,45,1607007117,1607007117
523,Whisper daily liners,Whisper,"With Whisper daily liners clean and fresh you stay fresh no matter what the day brings, thanks to their breathable design and Odour Neutralising Technology. They help you stay fresh all day long on your regular days, protecting you against vaginal discharge or on the days before your period when you are unsure about when it will start. These panty liners not only provide reliable protection against wetness but also have a floral scent for confidence that lasts all day.",xyz,1,1,45,1607007117,1607007117
524,Whisper Ultra clean,Whisper,"It's about living your life by your own rules despite what society says. It's about choosing for yourself, every day of the month. This revolutionary product whisper ultra clean xl+ has odour lock gel that locks upto 100% wetness and even odours and gives you the freedom to live life by your own rules, even during periods. Because meri life, mere rules.",xyz,1,1,45,1607007117,1607007117
525,Stayfree secure 40 pad,Stayfree,"For long lasting protection and comfort up to 12 hours, choose Stayfree secure cottony soft XL. Designed with wings, this extra large pad keeps you comfortable and secure for longer so you can move freely and with confidence. The Stayfree cottony soft pads come with a soft and delicate material that is gentle on your skin and prevents rashes and dryness.",xyz,1,1,45,1607007117,1607007117
526,Stayfree secure Ultra 40 pad,Stayfree,"For a superior dry feeling with better coverage than regular pads, choose Stayfree secure xl ultra thin. The pad is flexible, ultra-thin, extra large and fits your body, so you can stay secure and keep moving. Unlike thick pads, Stayfree secure xl ultra-thin fits the curves of your body and helps you move freely even on your period days.",xyz,1,1,45,1607007117,1607007117
527,Stayfree secure extra large ,Stayfree,"For long-lasting protection and comfort up to 12 hours, choose Stayfree Secure Cottony Soft XL. Designed with wings, this extra large pad keeps you comfortable and secure for longer so you can move freely and with confidence. It comes with a Super Absorb Design having raised centre with deep channels that give superior protection. Stayfree comes with Odour Control System that helps prevent the foul odour and keeps you feeling fresh.",xyz,1,1,45,1607007117,1607007117
528,Stayfree secure cottony soft cover,Stayfree,"For long lasting protection and comfort up to 12 hours, choose Stayfree secure cottony soft XL. Designed with wings, this extra large pad keeps you comfortable and secure for longer so you can move freely and with confidence. The Stayfree cottony soft pads come with a soft and delicate material that is gentle on your skin and prevents rashes and dryness.",xyz,1,1,45,1607007117,1607007117
529,Stayfree secure cotton Extra Large,Stayfree,"For a superior dry feeling with better coverage than regular pads, choose Stayfree secure xl ultra thin. The pad is flexible, ultra-thin, extra large and fits your body, so you can stay secure and keep moving. Unlike thick pads, Stayfree secure xl ultra-thin fits the curves of your body and helps you move freely even on your period days.",xyz,1,1,45,1607007117,1607007117
530,stayfree secure XL Ultra thin Dry Cover,Stayfree,*,xyz,1,1,45,1607007117,1607007117
531,stayfree secure Dry  Max,Stayfree,Get all round protection throughout the night with Stayfree dry-max all night. This specially designed ultra-thin napkin is extra-long and extra-wide in the back to prevent leakage from all sides no matter how much you move in your sleep. Now you can stay worry free and comfortable all night long. The super lock pockets with gel core lock in fluid for up to 100% protection with zero leakage and the odour control system helps prevent the foul odour and keeps you feeling fresh.,xyz,1,1,45,1607007117,1607007117
532,Sanipro 2x softer 280 MM STRAIGHT,Sanipro,"Many women and girls in India do not have access to sanitary pads - a critical aspect of women's personal hygiene With the mission to provide high quality, comfortable productthat was easy to use, SANIPRO was born. Sanipro has been designed to meetthe need of every woman for quality sanitary pads. SaniPro, is also committed towards community development.",xyz,1,1,45,1607007117,1607007117
533,Sanipro 2x softer 240 MM REGULAR,Sanipro,"Many women and girls in India do not have access to sanitary pads - a critical aspect of women's personal hygiene With the mission to provide high quality, comfortable productthat was easy to use, SANIPRO was born. Sanipro has been designed to meetthe need of every woman for quality sanitary pads. SaniPro, is also committed towards community development.",xyz,1,1,45,1607007117,1607007117
534,Sanipro 2x softer 310 MM TRI-FOLD,Sanipro,"Many women and girls in India do not have access to sanitary pads - a critical aspect of women's personal hygiene With the mission to provide high quality, comfortable productthat was easy to use, SANIPRO was born. Sanipro has been designed to meetthe need of every woman for quality sanitary pads. SaniPro, is also committed towards community development.",xyz,1,1,45,1607007117,1607007117
535,Sanipro 2x softer 280 MM TRI- FOLD,Sanipro,"Many women and girls in India do not have access to sanitary pads - a critical aspect of women's personal hygiene With the mission to provide high quality, comfortable productthat was easy to use, SANIPRO was born. Sanipro has been designed to meetthe need of every woman for quality sanitary pads. SaniPro, is also committed towards community development.",xyz,1,5,45,1607007117,1607007117
