1416,HARSHEY'S SYRUP GENUNINE CHOCOLATE FLAVOUR,Harshey's,"Hershey's Chocolate Syrup is a classic ingredient in chocolate milk and ice cream sundaes. ... The new syrup has just five ingredients compared to the 11 ingredients listed on the classic syrup bottles. The new syrup is made from: cocoa, water, natural vanilla flavor, pure cane sugar and organic invert cane syrup.",xyz,1,3,18,1607007117,1607007117
1417,HARSHEY'S SYRUP MILK BOOSTER CHOCOLATE FLAVOUR,Harshey's,Hersheys Chocolate Syrup + Calcium and Vitamin D is a great new way to get extra nutrition from the syrup you love. The delicious HERSHEYS Chocolate flavour syrup MILK BOOSTER doubles the Calcium of milk and adds Vitamin D necessary for Calcium absorption. Manufactured in India in state of the art manufacturing unit adhering to international quality and standards,xyz,1,3,18,1607007117,1607007117
1418,HARSHEY'S SYRUP DELICIOUS STRAWBERRY FLAVOUR,Harshey's,"Nothing says sweet like the classic taste of HERSHEY'S Syrup. With the easy squeeze bottles you can create glasses of chilled chocolate milk, chocolate floats, strawberry sundaes, rich hot cocoa and more!",xyz,1,3,18,1607007117,1607007117
1419,HARSHEY'S COCOA POWDER,Harshey's,Hershey's Cocoa is 100 percent Natural and Unsweetened. It contains antioxidants also found in tea and certain fruits. Enjoy delicious desserts and baking treats with Hershey's Cocoa. Try some unique recipes from HersheysKitchens.,xyz,1,3,18,1607007117,1607007117
1420,HARSHEY'S HOT CHOCOLATE POWDER,Harshey's,"Imagine a crisp fall evening or chilly winter day curled up with a good book, a blanket, your tablet and a fresh cup of Hershey's Milk Chocolate Hot Cocoa. It only takes a few minutes to get that hot chocolate in your hand. Hershey's Milk Chocolate Hot Cocoa Mix is ready in minutes and contains the kind of milk chocolate that melts in your mouth. If happiness came in a mug, it would taste like this. Store on a dry shelf.",xyz,1,3,18,1607007117,1607007117
1421,HARSHEY'S SPREADS COCOA WITH ALMOND,Harshey's,"Presenting Hershey's Spreads! Enjoy the delectable taste of chocolate with the goodness of real almonds. Enjoy the delicious taste of Hershey's spreads with bread, roti, paratha, idli, dosa, cake, biscuit, fruit, waffle, doughnut, croissant and much more. Spread the happiness with Hershey's!",xyz,1,3,18,1607007117,1607007117
1422,HARSHEY'S SPREADS COCOA ,Harshey's,"Presenting Hershey's Spreads! Enjoy the delectable taste of chocolate in every bite. Enjoy the delicious taste of Hershey's spreads with bread, roti, paratha, idli, dosa, cake, biscuit, fruit, waffle, doughnut, croissant and much more. Spread the happiness with Hershey's!",xyz,1,3,18,1607007117,1607007117
1423,PEANUT BUTTER CREAME,Harshey's,"""Nut butters, particularly peanut butter, is a source of unsaturated fats, which are proven to be good for our heart and general health. Plus, it is a good source of fibre and protein too. And both provide satiety, so keep you full for longer.""",xyz,1,2,18,1607007117,1607007117
1424,PEANUT BUTTER CRUNCHY,Peanut,"FunFoods brings you the crunchy version of peanut butter. Every jar is blended with loads of real peanut pieces so you get the fun flavor of FunFoods Peanut Butter, plus crazy-good crunchiness.Make tasty peanut butter and jelly sandwich or enjoy crunchier version of peanut butter milk shake. ",xyz,1,2,18,1607007117,1607007117
1425,SUDROP PEANUT BUTTER ,Peanut,Sundrop Peanut Butter is a tasty bread spread made of roasted peanuts (90% by weight). It is healthy for everyone in the family because it has zero cholesterol and zero trans-fats.Sundrop Peanut Butter is a power packed spread loaded with proteins (25% of each serving is made up of proteins).You get as much proteins from 11/2 tablespoons (24g) of Sundrop Peanut Butter as from a large glass of Cow's Milk.,xyz,1,2,18,1607007117,1607007117
1426,KISSAN PEANUT BUTTER CEAME,Kissan,"Kissan Peanut Butter creamy with 100% real peanuts handpicked from the farms, is a rich source of protein and good fats. The ideal option for mothers looking for protein-based food for their child. It has no added colours, preservatives or flavours. Made with 100% real peanuts handpicked from the farms of Gujarat.",xyz,1,2,18,1607007117,1607007117
1427,NUTELLA,Nutella,"Nutella's chocolate spread makes sure that your breakfast is tasty. Best enjoyed with bread, this spread is made from pure cocoa without any artificial colour or preservatives.",xyz,1,3,18,1607007117,1607007117
1428,Priaya Gongura Pickle with Garlic,Priya,Priya Gongura Onion Pickle lets the natural taste of onion absorb into its Gongura flavor creating an aromatic and enthralling flavor. It is yet again inspired by the Telugu kitchen.,xyz,1,3,18,1607007117,1607007117
1429,Priya Mixed Vegetable with Garlic,Priya,"True to its tradition of ramoji group, Priya foods is committed to provide you with the best flavors of India. Its been spreading Indian fragrance all over the world since 1980. Come discover the world of Priya.",xyz,1,3,18,1607007117,1607007117
1430,Priaya Ginger Pickle with Garlic,Priya,"PRIYA's Ginger Pickle is a biting pungent & spicy pickle processed with fresh ginger, refined oil & aromatic spices. For ages, this ginger pickle not only makes the meal memorable but also enhances the taste when eaten  with Idli, Dosa or Medu Vada be it in home or office.",xyz,1,3,18,1607007117,1607007117
1431,Priya Cut Mango Pickle with Garlic,Priya,"True to its tradition of ramoji group, Priya foods is committed to provide you with the best flavors of India. Its been spreading Indian fragrance all over the world since 1980. Come discover the world of Priya.",xyz,1,3,18,1607007117,1607007117
1432,Priaya Exotic Karela Pickle without Garlic,Priya,"Priya Foods wields the magic wand to make the bitterness of Karela an irresistible engagement. The Karela pickle is specially made with finest bitter gourd and blends the most appropriate ingredients. The pickle enjoys long life and is simple and best to eat with any dish, any time.",xyz,1,3,18,1607007117,1607007117
1433,Priya Red Chilli Pickle with Garlic,Priya,"Priya's Red Chilli Pickle is a delicious pickle reminding of the red-hot Andhra chillies that are unmatched in their pungency and hot taste, yet make any meal exciting. The lingering taste of this spicy pickle will leave your mouth watering all day! ",xyz,1,3,18,1607007117,1607007117
1434,Priaya Mango Avakaya Pickle with Garlic,Priya,"Think Telugu pickle, think Avakai. The Globally renowned and timeless, Telugu Avakai is incomparable in its make and taste, created with a special process and exciting recipe.
Priya Foods is proud to bottle the flagship pickle and take it far more places. It blends select mangoes, finest oils and aromatic spices for a great taste and feast.",xyz,1,3,18,1607007117,1607007117
1435,Priya Carrot Pickle without Garlic,Priya,"True to its tradition of ramoji group, Priya foods is committed to provide you with the best flavors of India. Its been spreading Indian fragrance all over the world since 1980. Come discover the world of Priya.",xyz,1,3,18,1607007117,1607007117
1436,Priaya Garlic Pickle,Priya,"Priya's Garlic Pickle is yet another novel indulgence made out of otherwise indispensable ingredient of the India kitchen - Garlic.The aroma is finely captured and made into a pickle to give even the best of sauces and ketchup a run for money, because Priya's Garlic Pickle forms the most delightful accompaniment for any of the so-called fast foods.",xyz,1,3,18,1607007117,1607007117
1437,Priya DrumSticks Pickle without Garlic,Priya,"Priya's new exotic drumstick pickle: Our specialty product, this rare and distinct flavour will leave your taste buds tingling. Tastes good with rice and snacks.",xyz,1,3,18,1607007117,1607007117
1438,Priaya Mangotokku Pickle with Garlic,Priya,"Mango thokku is a popular pickle in South India made out of mango and embellished and garnished to guarantee taste, aroma and pungency. Thokku forms the tastiest accompaniment for many dishes and is made with select quality mangoes, finest oils and aromatic spices.",xyz,1,3,18,1607007117,1607007117
1439,Priya Amla Pickle with Garlic,Priya,Priya amla or the indian gooseberry pickle is the most elegant signature of tanginess making the trendiest and tastiest citrus pickle with finely sourced fruits.,xyz,1,3,18,1607007117,1607007117
1440,Priaya Coriander Pickle without Garlic,Priya,"Arguably one of the highly popular products from the Priya Foods stable, the Coriander Pickle is uniquely flavored and specially prepared with fresh coriander leaves. It's time to surprise the near and dear with the taste.",xyz,1,3,18,1607007117,1607007117
1441,Priya Lime Pickle with Garlic,Priya,Priya's Lime Pickle is a irresistible element of the South Indian Kitchen and comes with an authentic taste to make the curd rice yummier and a perfect companion with every meal in travel.,xyz,1,3,18,1607007117,1607007117
1442,Priya Exotic Onion Pickle ,Priya,"Priya Foods always stood as a glorious representative of the Indian kitchen. It redefined the way even the simplest yet tasty Indian recipes are brought to the table.One such easy to make yet tricky in decoding the secret of taste is the Onion Pickle. Pearl onions, finest oils and aromatic spices make it a divine combo.",xyz,1,3,18,1607007117,1607007117
1443,Priya Tomato pickle with Garlic,Priya,"Priya Tomato pickle is a lip-smacking pickle absorbing the freshness, pungency and flavor of Tomatoes that are sourced fresh from farms. The authentic Indian pickle is simple in its making yet sizzling in its offering.
Priya Tomato Pickle is a meal mandatory and goes perfect with snack and breakfast items top.",xyz,1,3,18,1607007117,1607007117
1444,Aachi Cut Mango Pickle,Aachi,It is tasty and healthy.,xyz,1,3,18,1607007117,1607007117
1445,Aachi  Mango Thokku Pickle,Aachi,It is tasty and healthy.,xyz,1,3,18,1607007117,1607007117
1446,Aachi Mango Avakkai Pickle,Aachi,It is tasty and healthy.,xyz,1,3,18,1607007117,1607007117
1447,Aachi Tomato Pickle,Aachi,It is tasty and healthy.,xyz,1,3,18,1607007117,1607007117
1448,Aachi Lime Pickle,Aachi,It is tasty and healthy.,xyz,1,3,18,1607007117,1607007117
1449,Aachi Mango Ginger Pickle buy 1 Get 1,Aachi,It is tasty and healthy.,xyz,1,3,18,1607007117,1607007117
1450,THREE MANGO RED CHILLI PICKLE,Three Mango,"Think Telugu pickle, think Avakai. The Globally renowned and timeless, Telugu Avakai is incomparable in its make and taste, created with a special process and exciting recipe.",xyz,1,3,18,1607007117,1607007117
1451,THREE MANGO MANGO PICKLE,Three Mango,"Pickle is a delicious Indian recipe served as a side dish. Indian pickles made from a variety of vegetables and fruits are very popular all over the world as they are delicious, lip-smacking and explode with various super flavours. This Mango Pickle from the house of Three Mango is export quality pickle which is made with Three Mango Chilli Powder to make it extraordinary. These pickles are free from class I and class II preservatives (citric acid, acetic acid and sodium benzoate, etc).",xyz,1,3,18,1607007117,1607007117
1452,THREE MANGO MIXED VEGETABLE PICKLE,Three Mango,"Three mango mirch powder pickle is prepared from best Warangal Bamboo Mirch. The chilli is chosen in the traditional way - it has to be crunchy, sun-dried, red in colour and free of impurities. This process makes sure that the chilli powder is has a good taste and is natural red in color.",xyz,1,3,18,1607007117,1607007117
1453,THREE MANGO LIME PICKLE,Three Mango,"Pickle is a delicious Indian recipe served as a side dish. Indian pickles made from a variety of vegetables and fruits are very popular all over the world as they are delicious, lip-smacking and explode with various super flavours. Three Mango Lime Pickle is export quality pickle which is made with Three Mango Chilli Powder to make it extraordinary. These pickles are free from class I and class II preservatives ",xyz,1,3,18,1607007117,1607007117
1454,THREE MANGO TOMATO PICKLE,Three Mango,"Three Mango Tomato Pickle is export quality pickle which is made with Three Mango Chilli Powder to make it extraordinary. These pickles are free from class I and class II preservatives (citric acid, acetic acid and sodium benzoate, etc).",xyz,1,3,18,1607007117,1607007117
1455,TWIN BIRDS CHICKEN PICKLE,Twin Birds,"Add more spice and flavour to any meal with Twin Birds Chicken Pickle, a zesty preparation loaded with chunks of boneless chicken in authentic spices. Hot and tangy, this mouth-watering pickle can be enjoyed with any type of meal like roti, bread or rice.",xyz,1,3,18,1607007117,1607007117
1456,SWASTICS GINGER PICKLE,Swatics,Swastik's pickles a versatile side dish adaptable with any food you have is prepared from the choicest spices giving you a unique flavour and is indeed a peppy addition to your daily food.,xyz,1,3,18,1607007117,1607007117
1457,SWASTICS RED CHILLI PICKLE,Swatics,Swastik Red Chilli Pickle is being loved by everyone due to its great taste and quality features. The Red Chilli offers a unique sense of cuisine and has a bitter taste.,xyz,1,3,18,1607007117,1607007117
1458,SWASTICS MIX VEGETABLE PICKLE,Swatics,Swastiks Mixed Vegetable Pickle a unique taste that captures the essence of several vegetables. This Pickle is distinct in terms of the diverse vegetable tastes that combine to make it a great accompaniment for many rice and chapatti dishes. It's also great for snacks and breakfast items.,xyz,1,3,18,1607007117,1607007117
1459,SWASTICS GONGURA PICKLE,Swatics,"It's a revelation for those who are not already addicted to the mystical flavour of Gongura leaves. These leaves blended with the other tangy spices is the secret behind the mouth watering nature of this pickle. An all-time hit among those with a liking for the spicier way of life, this pickle is must have among the others in your kitchen.",xyz,1,3,18,1607007117,1607007117
1460,SWASTICS LIME PICKLE,Swatics,"The tangy taste of lime blended to a perfect concoction of a selected spices to make it a taste worthy accompaniment to most north Indian cuisines and the best accepted and balanced with Indian staples, rotis, theplas.",xyz,1,3,18,1607007117,1607007117
1461,SWASTICS MANGO PICKLE,Swatics,The goodness & mischief of mango meets the wild side of chilles and other spices to give you a twang in your tongue. Simply addictive.,xyz,1,3,18,1607007117,1607007117
1462,SWASTICS AMLA PICKLE,Swatics,One of the most important and versatile fruit available in warm region / climate. It is a rich source of vitamins and minerals with many medical health benefits and called as elixir of good health. This piquant amla delicacy is spiced with blend of spices. The unique taste food enriches your meal everytime you have.,xyz,1,3,18,1607007117,1607007117
1463,SWASTICS TOMATO PICKLE,Swatics,Swastik tomato Pickle is really an amazing pickle in almost every sense. The Tomato is recognized as the Queen of vegetables and one of the most universally used vegetables in India. The Tomato pickle must also take pride of place in the pickle parade....,xyz,1,3,18,1607007117,1607007117
1464,Tirumala Non Fruit Vinegar,Tirumala,"Non fruit white vinegar used for food, pantry, cooking, onion & salads.",xyz,1,4,16,1607007117,1607007117
1465,Anchor Synthetic Vinegar,Anchor,"Material feature: veg container type: bottle ingredients: water and acetic acid included items: vinegar special feature: no preservatives can be used for softening meat, storage instructions: keep in a cool place.",xyz,1,4,16,1607007117,1607007117
1466,Veeba Barbeque Sauce,Veeba,"All our sauces and dressings have exceptionally low fat content, at the same time retaining that perfect balance of taste and flavour. Not just that, to ensure unmatched quality, all Veeba sauces are manufactured in an iso 22000 certified plant. Customer convenience is the top priority here at Veeba, thus all Veeba sauces and dressings come in specially designed ergonomical bottles, with an easy to apply dispensing system. ",xyz,1,3,16,1607007117,1607007117
1467,Chings Chilli Vinegar,Chings,"Drizzle a few drops of Ching's secret chilli vinegar sauce to make your dish mouth-watering. This sauce enhances the flavour by combining its vivid green jwala chilli with your food. The Ching's secret chilli vinegar sauce will give your favourite dish the delicious edge that it needs and tingle your taste buds. An ideal dining table companion, this sauce has a sharp vinegar heat that will complement various dishes.",xyz,1,4,16,1607007117,1607007117
1468,Chings Green Chilli Sauce,Chings,Perfect dining table companions! No dining table is complete without the ever-popular Ching's Sauces. The zingy Green Chilli Sauce that adds a buzz to any snack. This sauce is the perfect way to enhance the flavours of your favourite Desi Chinese dishes. You can also try - the rich brown Soy Sauce which is great for stir-fries and marinades.,xyz,1,3,16,1607007117,1607007117
1469,Chings Red Chilli Sauce,Chings,Perfect dining table companions! No dining table is complete without the ever-popular Ching's Sauces. The Red Chilli Sauce that's a great snack dip. This sauces is the perfect way to enhance the flavours of your favourite Desi Chinese dishes. You can also try - the rich brown Soy Sauce which is great for stir-fries and marinades. The edgy Chilli Vinegar that makes Desi Chinese dishes come alive and the zingy Green Chilli Sauce that adds a buzz to any snack.,xyz,1,3,16,1607007117,1607007117
1470,Chings Dark Soya Sauce,Chings,"Flavour up your desi Chinese dishes with Ching's Secret Dark Soy Sauce for an authentic taste. A slow-fermented sauce with intriguing flavours, this dark soy sauce can enrich your stir-fried noodles or rice instantly.",xyz,1,3,16,1607007117,1607007117
1471,Chings Dark Soya Sauce (Bottle),Chings,"Flavour up your desi Chinese dishes with Ching's Secret Dark Soy Sauce for an authentic taste. A slow-fermented sauce with intriguing flavours, this dark soy sauce can enrich your stir-fried noodles or rice instantly.",xyz,1,3,16,1607007117,1607007117
1472,Chings Chilli Sauce,Chings,"Liven up your snack times with Ching's Secret Red Chilli Sauce. A fiery sauce made with the finest red chillies, spices and vinegar, this condiment is all that you need to pep up your snacks and enjoy a lip-smacking dip.",xyz,1,3,16,1607007117,1607007117
1473,Chings Green Chilli Sauce (Pauch),Chings,Perfect dining table companions! No dining table is complete without the ever-popular Ching's Sauces. The zingy Green Chilli Sauce that adds a buzz to any snack. This sauce is the perfect way to enhance the flavours of your favourite Desi Chinese dishes. You can also try - the rich brown Soy Sauce which is great for stir-fries and marinades.,xyz,1,3,16,1607007117,1607007117
1474,Chings Red Chilli Sauce (pauch),Chings,Perfect dining table companions! No dining table is complete without the ever-popular Ching's Sauces. The Red Chilli Sauce that's a great snack dip. This sauces is the perfect way to enhance the flavours of your favourite Desi Chinese dishes. You can also try - the rich brown Soy Sauce which is great for stir-fries and marinades. The edgy Chilli Vinegar that makes Desi Chinese dishes come alive and the zingy Green Chilli Sauce that adds a buzz to any snack.,xyz,1,3,16,1607007117,1607007117
1475,Chings Dark Soya Sauce (pauch),Chings,"Flavour up your desi Chinese dishes with Ching's Secret Dark Soy Sauce for an authentic taste. A slow-fermented sauce with intriguing flavours, this dark soy sauce can enrich your stir-fried noodles or rice instantly.",xyz,1,3,16,1607007117,1607007117
1476,Chings Schezwan Stir fry Sauce,Chings,"Chutney Nahin, Rocket Hai, Rocket! Ching's Schezwan Chutney is the most versatile chutney ever! You can use it as a dip or a spread and even cook with it. On its own it becomes a spicy dip for snacks like fries, pakoras and bhajiya or starters like spring rolls. Spread it on anything - from dosa and vada pav to paratha and pizza - to add some extra zing. ",xyz,1,3,16,1607007117,1607007117
1477,Chings Schezwan Chutney,Chings,"Chings Schezwan Chutney is a tasty condiment that can be used as a dip or spread or added to food to make it flavoursome. This amazing fusion of pungent ginger-garlic paste and red chillies, is laced with Chinese spices and Schezwan pepper. A dash of Indian spices makes this chutney spicier.",xyz,1,3,16,1607007117,1607007117
1478,Hillers Red Chilli Sauce,Hillers,"Our customers can obtain from us an array of Chilli Sauce. Our array of chilli sauce is hygienically produced with fresh red chillies under a controlled temperature process. These are of top nutritional value and can be served with snacks, fried or roasted appetizers. Our sauce retains the original and essential nutrients, taste and aroma of the base ingredients.",xyz,1,3,16,1607007117,1607007117
1479,Hillers Green Chilli Sauce,Hillers,"Our engaged in providing Green Chili Sauce that can be obtain by customers at market leading prices. These are developed available in institutional packs. These are processed using fresh green chillies, that are combined with freshly prepared vegetable pulp, coriander, mint and garlic. Provided under the brand name of HILLERS,",xyz,1,3,16,1607007117,1607007117
1480,Hillers Dark Soya Sauce,Hillers,"Due to our enormous understanding and massive knowledge of this business, we are involved in offering Hillers",xyz,1,3,16,1607007117,1607007117
1481,Sanghi Red Chilli Sauce,Sanghi,The Highly evolved taste of authentic chinees food has been developed over 1000 of years. The secret process of formination maturing and mixing has given a special flavour to many unit dishes which are appealing for their freshness and purity. We at Sanghi have also been part of a similar process of developing unique recipes which are approved and used by top chefs of high repute to give you the same true and authentic taste of various regions of china.,xyz,1,3,16,1607007117,1607007117
1482,Sanghi Dark Soya Sauce,Sanghi,"
The Highly evolved taste of authentic chinees food has been developed over 1000 of years. The secret process of formination maturing and mixing has given a special flavour to many unit dishes which are appealing for their freshness and purity. We at Sanghi have also been part of a similar process of developing unique recipes which are approved and used by top chefs of high repute to give you the same true and authentic taste of various regions of china.",xyz,1,3,16,1607007117,1607007117
1483,Patanjali Apple Vinegar,Patanjali,Lowers blood sugar level. Helps with weight loss. Reduces cholestrol. Improves symptoms of diabetes.,xyz,1,4,16,1607007117,1607007117
1484,Kissan Mixed Fruit Jam,Kissan,"All your favorite fruits come together in Kissan Mixed Fruit Jam. A medley of flavours from 8 fruits such as Banana, Papaya, Apple, Pear, Pineapple, Mango, Grape and Orange blended in to one lip smacking jam. Kissan jam is the best jam with the goodness of your favorite 8 fruits. Kissan Mixed Fruit Jam is best partnered with bread to provide yummy on the go breakfast for your kid every morning. ",xyz,1,3,16,1607007117,1607007117
1485,Kissan Tomato Kethup (pouch),Kissan,"This one's definitely a winner when it comes to cajoling your kids into eating their food. Its remarkable flavour comes from the 100 percentage real juicy tomatoes that have gone in making it. It's an assured hero for all the snacks, be it samosas, pakodas, noodles or plain roti roll - a perfect ally for making wholesome and yummy food. Spread it on a crunchy cracker, roll it up in a roti roll, pour it on a samosa or noodles for your kids' tiffin time with an assortment of flavours.",xyz,1,4,16,1607007117,1607007117
1486,Kissan Tomato Kethup ,Kissan,"Kissan Fresh* Tomato Ketchup is made with 100% real, naturally ripened Tomatoes. The Tangy Tomato Ketchup can either be paired with or complemented with almost every dish to make them so much tastier.",xyz,1,4,16,1607007117,1607007117
1487,Kissan NO Onion NO Garlic Tomoto Sauce,Kissan,"This Tomato Ketchup by Kissan contains No Onion and No Garlic, and yet wonderfully adds flavor and tang to your food. Created with the purest and ripest tomatoes and the finest technology, the ketchup has a true tomato flavor that you always want in your plate. The vibrant color and lip smacking taste attracts kids to savor not only their burgers but also regular healthy, home cooked food. ",xyz,1,3,16,1607007117,1607007117
1488,Kissan CHOTU Fresh Tomoto Kechup,Kissan,"Kissan Tomato Ketchup is made from fresh and fine quality tomatoes. It has natural taste and aroma that can make your regular dish tasty. The tangy red burst of tomatoes in ketchup will give you the sensorial delight of nature's goodness. Kissan Fresh tomato ketchup is made from 100% real tomatoes. This ketchup is thick, naturally red and stays fresh for long.",xyz,1,4,16,1607007117,1607007117
1489,Aachi Mixed Fruit Jam,Aachi,"AachiMixed Fruit Jam Has A Flavorsome Appeal With Its Fresh, Delicious Mixed Fruits. Its Smooth Texture Is Easy To Spread And Goes Well With A Number Of Food Items. The Jam Is Packaged To Ensure That Its Flavor Is Retained For A Long Time. So Pick This Bottle, Indulge Your Taste Buds In The Tasty Aachi Mixed Fruit Jam And Bring Your Everyday Snacks To A Whole New Level Of Fun!",xyz,1,3,16,1607007117,1607007117
1490,Tomato Ketchup Pouch,Smith & John ,"Smith & Jones Tomato Ketchup is 100% usual, with extremely no preservatives. And it is made from high quality tomato paste, our Tomato Ketchup is an unique blend of wealthy flavour and savour.",xyz,1,4,16,1607007117,1607007117
1491,Dabur Honey Bottle,Dabur,"Dabur Honey is one of the healthiest substitute for refined sugar with wholesome natural goodness. Dabur Honey is procured from the purest of sources from the forests, Himalayas and other specified regions.",xyz,1,2,16,1607007117,1607007117
