1,Colgate strong Teeth Tooth Paste,colgate,"Your trusted Colgate Strong Teeth Toothpaste now comes with Amino Shakti, a unique formula containing Arginine with an insoluble source of calcium and fluoride. This new, best ever Colgate STRONG Teeth formula (^vs previous formula), with Amino Shakti, provides 4X strengthening power** by providing protection from a mineral loss against acid attack vs. an ordinary fluoride toothpaste. The toothpaste helps add natural calcium ~from saliva through fluoride action and strengthens teeth from within.
This anticavity toothpaste also provides cleaner teeth and fresher breath with regular use, when used as directed as a part of your daily oral care hygiene and regular professional care routine, as directed by a dentist. Colgate, India's No.1 Toothpaste (#Based on market share data), is always 100% vegetarian toothpaste.",xyz,1,4,40,1607007117,1607007117
2,Colgate Total Tooth Paste,colgate,"Colgate Total Advanced Health is an anti-cavity plus anti-gingivitis toothpaste, which effectively fights germ build-up for superior oral health vs. regular fluoride toothpaste. Effective decay preventive dentifrice prevents and reduces gingivitis when used as directed in a conscientiously applied programme of oral hygiene and regular professional care. It helps reduce the formation of plaque and tartar above the gum line when used regularly. The unique clinically proven formula creates an anti-germ barrier and protects 100% of the surfaces of the mouth including teeth, tongue, cheeks, and gums. 

Colgate Total Advanced Health Toothpaste works as a protective shield around your teeth and gums fighting germs non-stop for 12 hours, even after drinking and eating. Colgate is India's No. 1 brand recommended by dentists and offers unique oral hygiene solutions to ensure complete protection against germs and plaque build-up.",xyz,1,4,40,1607007117,1607007117
3,Colgate Max Fresh blue Tooth Paste,colgate,"Colgate Max Fresh Peppermint Ice Gel Toothpaste comes with cooling crystals which help in keeping you refreshed for a long time. 
Experience intense cooling and a refreshing blast of peppermint ice to transform your day and fight cavities at the same time. It keeps germ build-up at bay and maintains a healthy and refreshing oral hygiene. 
The clear blue gel toothpaste also whitens your teeth with every brush, so you can smile with a never before confidence! 
Colgate is India's No. 1 recommended toothpaste brand and offers unique oral hygiene solutions to ensure complete protection against germs and plaque build-up.",xyz,1,4,40,1607007117,1607007117
4,Colgate Max Fresh red Tooth Paste,colgate,"Colgate MaxFresh Spicy Fresh Gel Toothpaste comes with cooling crystals which help in keeping you refreshed for a long time. Experience intense cooling and a refreshing blast of flavor to transform your day and fight cavities at the same time. It keeps germ build-up at bay and maintains a healthy and refreshing oral hygiene. The clear red gel toothpaste also whitens your teeth with every brush, so you can smile with a never before confidence!Colgate is India's No. 1 brand recommended by dentists and offers unique oral hygiene solutions to ensure complete protection against germs and plague build-up.",xyz,1,4,40,1607007117,1607007117
5,Colgate Herbal Tooth Paste,colgate,"Colgate Herbal toothpaste brings to you a unique blend of Herbal extracts for healthier teeth and gums. This herbal toothpaste strikes a perfect balance between the science of Colgate and Natures herbs to bring to you the best of both. This toothpaste contains natural herbs like Chamomile, Eucalyptus, Myrrh and Sage which are known for their Oral care benefits. Colgate toothpaste is No. 1 recommended toothpaste in India.",xyz,1,4,40,1607007117,1607007117
6,Colgate Charcol clean Tooth Paste,colgate,"Your trusted Colgate now brings an all-new mouth experience with Charcoal Clean Toothpaste. Revive your senses with the goodness of Bamboo Charcoal and Wintergreen Mint for pure clean mouth experience. Bamboo Charcoal is known for cleaning properties and Wintergreen Mint is known for purifying breath. The gel-based toothpaste is extremely minty and helps in freshening your breath. Colgate, India's No.1 Toothpaste (#Based on market share data), is always 100% vegetarian toothpaste.",xyz,1,4,40,1607007117,1607007117
7,colgate Cibaca Tooth Paste,colgate,"Colgate Cibaca Toothpaste has ingredients such as Thymol, Lemon, Camphor, Clove, Eucalyptus, Basil that fights hidden germs to give stronger & whiter teeth. The deep cleaning action fights hidden germs, giving complete protection for your entire family. It's a 100% vegetarian formula and its refreshing mint flavour freshens breath for a happy and a dazzling smile. So what are you waiting for? Buy the product online at the best rate, right here!",xyz,1,4,40,1607007117,1607007117
8,Colgate Salt Tooth Paste,colgate,Colgate Active Salt is an anti-cavity toothpaste with the goodness of salt and minerals which help fight germs. Refreshing minty flavour gives fresher breath when used as directed for oral hygiene. Colgate Active Salt's unique formula helps fight germs and provide you with healthier and cleaner teeth. Brush twice a day with Colgate Active Salt toothpaste as recommended by dentists. Colgate is India's No. 1 brand recommended by Dentists and offers unique oral hygiene solutions to ensure complete protection against germs and plague build-up.,xyz,1,4,40,1607007117,1607007117
9,Colgate Veda Shakthi Tooth Paste,colgate,"Colgate Swarna Vedshakti Toothpaste is the perfect blend of age-old natural ingredients and years of trusted oral care expertise. It tastes good and cares for your entire family's oral health, giving them complete protection. 100% vegetarian, the product comes infused with unique natural ingredients such as clove, neem, honey, amla & tulsi to strengthen your teeth and gums with a soothing massage effect. Colgate is India's No. 1 brand recommended by dentists and offers unique oral hygiene solutions to ensure complete protection against germs and plaque build-up.",xyz,1,4,40,1607007117,1607007117
10,colgate Sensitive plus Tooth Paste,colgate,"India's most trusted oral care brand brings an exclusive sensitive plus-anticavity toothpaste made with Pro-Argin technology to give an instant and lasting relief from tooth sensitivity from the single-use. The Pro-Argin technology uses arginine, an amino acid naturally found in saliva and calcium carbonate, to build a calcium-rich layer for instant* relief in seconds and with continuous use provides long-lasting relief. This technology aids to open the blocked tubules and protect sensitive teeth by building long-lasting protection against sudden shocks of pain. 
Good oral care habits keep your teeth and gums healthy, preventing tooth decay, gum disease and bad breath. Maintaining good oral hygiene includes brushing twice a day for 2 minutes each time, rinsing with mouthwash for 30 seconds, and replacing your toothbrush every 3 months.
Children under 12 years of age: Use only on the advice of a Dentist or a Doctor. Sensitive teeth may indicate an underlying problem that may need prompt care by the dentist. Consult a Dentist if the problem persists. Do not swallow.",xyz,1,4,40,1607007117,1607007117
11,Colgate Salt Neem Tooth Paste,colgate,"Colgate Active Salt Neem Toothpaste is packed with the goodness of salt and neem. TThis unique blend of natural ingredients in a scientific formulation helps fight germs and keep gum problems like Pyorrhea away while also giving you healthy & tight gums. Its refreshing minty taste freshens breath. So what are you waiting for? Buy the product online at the best rate, right here!",xyz,1,4,40,1607007117,1607007117
12,Colgate Salt Lemon Tooth Paste,colgate,Colgate Active Salt with salt & lemon is an anti-cavity toothpaste with the goodness of natural ingredients. Power of active salt and lemon helps keep remove yellowness with regular brushing. Refreshing minty flavour gives fresher breath when used as directed for oral hygiene. Both the ingredients help fight germs and provide you with healthier and cleaner teeth. Brush twice a day with Colgate Active Salt Lemon toothpaste as recommended by dentists. Colgate is India's No. 1 brand recommended by Dentists and offers unique oral hygiene solutions to ensure complete protection against germs and plague build-up.,xyz,1,4,40,1607007117,1607007117
13,Colgate visi white Tooth Paste,colgate,"Colgate Visible White Dazzling White Toothpaste, the expert in oral care, gives you whiter teeth in one week. The unique formula of the paste is infused with whitening accelerators that safely exfoliate stains and polish the teeth surface for a dazzling white smile. It helps fight cavities, protect enamel, remove plaque and freshens breath.",xyz,1,4,40,1607007117,1607007117
14,Colgate Acticve Salt Lemon Tooth Paste,colgate,"Colgate Active Salt Healthy White Lemon Toothpaste keeps your mouth fresh throughout the day. This paste easily dissolves in the mouth and cleanses it effectively, giving you shinier and brighter teeth. It removes foul mouth odour and gives you refreshing breath. It removes dental plaque and prevents tooth decay. Power of Salt and Lemon removes yellowness from teeth.",xyz,1,4,40,1607007117,1607007117
15,Colgate Plax Fresh Tea Tooth Paste,colgate,"Protect your mouth from germs and get fresh breath every morning with Colgate Plax Fresh Tea Mouthwash. It removes over 99% of bad breath causing germs in your mouth, for a fresher and cleaner mouth than brushing alone. Colgate Plax Fresh Tea Mouthwash contains natural tea extracts that give away a refreshingly pleasant aroma. It is Alcohol-free so you experience no burning sensation, just 10x longer cooling sensation vs. brushing alone!Make Colgate Plax a part of your daily oral hygiene. Use it twice a day after brushing, for a cleaner, fresher and healthier mouth. When used as directed, Colgate Plax mouthwash can also help prevent cavities, protect against germ build-up and provide healthier gums vs. a non-antiseptic mouthwash.",xyz,1,4,40,1607007117,1607007117
16,Colgate Plax Fresh Mint Splash Tooth Paste,colgate,"Protect your mouth from germs and get fresh breath every morning with Colgate Plax Freshmint Splash Mouthwash. It removes over 99% of bad breath causing germs in your mouth, for a fresher and cleaner mouth than brushing alone. Colgate Plax Freshmint Splash Mouthwash contains a freshening flavour that gives you mouth refreshment and a boost of confidence with every use. It is Alcohol-free so you experience no burning sensation, just fresher smiles between brushings!Make Colgate Plax a part of your daily oral hygiene. Use it twice a day after brushing, for a cleaner, fresher and healthier mouth. When used as directed, Colgate Plax mouthwash can also help prevent cavities, protect against germ build-up and provide healthier gums vs ordinary mouthwash.",xyz,1,4,40,1607007117,1607007117
17,Colgate Plax Peppermint Flash Tooth Paste,colgate,"Colgate Plax removes over 99% of germs & helps control bad breath 24 hours a day, 7 days a week. Protects against GERM build up. Provides healthier gums. No burning sensation. Gives long lasting fresh breath. Helps prevent cavities.",xyz,1,4,40,1607007117,1607007117
18,Colgate kids Tooth Powder Bubble Flavour 6+ years,colgate,"A delicious bubble fruit flavoured toothpaste makes brushing fun. Their favourite cartoon character now helps children fights cavities. It contains fluoride that provides cavity and enamel protection. A cool, minty fruit taste that helps freshen breath. Its sparking colourful gel makes kids want to brush regularly. Kids must brush their teeth at least 2 times a day and Colgate Kids Spiderman toothpaste is a fun way to ensure they enjoy good oral care habits early on! This delicious fruit flavoured toothpaste is specially designed for children of age 6 years and above who have newly erupted or developing permanent teeth. The toothpaste effectively cleanses their mouth, leaving it fresh. The toothpaste for kids also provides a clinically proven cavity and enamel protection. Its sparking colourful gel of Colgate bubble fruit toothpaste makes brushing fun for kids. Developed with the help and expertise of paediatric dentists, Colgate offers healthy and thoroughly clean teeth. It ensures the smile of the kids gets only brighter and cleaner with every use.",xyz,1,4,40,1607007117,1607007117
19,Colgate kids Tooth Powder strawberry Flavour ,colgate,"A delicious strawberry flavoured toothpaste makes brushing fun. Their favourite cartoon character now helps children fights cavities. It contains fluoride that provides cavity and enamel protection. A cool, minty fruit taste that helps freshen breath. Its sparking colourful gel makes kids want to brush regularly. Kids must brush their teeth at least 2 times a day and Colgate Kids Barbie toothpaste is a fun way to ensure they enjoy good oral care habits early on! This delicious fruit flavoured toothpaste is specially designed for children of age 6 years and above who have newly erupted or developing permanent teeth. The toothpaste effectively cleanses their mouth, leaving it fresh. The toothpaste also provides a clinically proven cavity and enamel protection. Its sparking colourful gel of Colgate strawberry toothpaste makes brushing fun for kids. Developed with the help and expertise of paediatric dentists, Colgate offers healthy and thoroughly clean teeth. It ensures the smile of the kids gets only brighter and cleaner with every use.",xyz,1,4,40,1607007117,1607007117
20,Colgate kids Tooth Powder Bubble Flavour 2- 5 years,colgate,"Kids must brush their teeth two times - once in the morning and then in the night. Colgate Kids Anticavity Toothpaste is a fun way to ensure they enjoy good oral care habits early on! This delicious toothpaste is especially designed for children from age 2 to 5 years who have front baby teeth and developing molars. Colgate Anticavity Toothpaste for Kids now comes with free Motu Patlu trading cards inside, making brushing fun with amusing cartoon characters by their side. The toothpaste provides clinically proven cavity and enamel protection. ",xyz,1,4,40,1607007117,1607007117
21,Colgate kids Tooth Powder strawberry Flavour 3-5 years,colgate,"Colgate Barbie Strawberry Flavor Toothpaste 80g Buy fun with protection for your kids!Kids, just like adults, need perfect and complete care for their teeth too. Colgate Strawberry Tooth Paste Kids 80G has brought together those essential cleaning features with the required delicacy for your little ones. This toothpaste manufactured by Colgate Palmolive India fights against all dental and gum problems of children!Parents do not have to bother any more about their kids' teeth-brushing problem as it has been designed in an attractive pack along with the flavour of juicy strawberries, which is simply loved by most children.",xyz,1,4,40,1607007117,1607007117
22,Colgate Tooth Powder super Rakshah,colgate,"Colgate Toothpowder ensures complete oral care delivering healthy gums, all-round germ protection, plaque removal and a whiter smile. The calcium and mineral rich formula keep teeth healthy and strong. Colgate tooth powder has the super rakshak formula that make your teeth upto 2 times stronger.",xyz,1,4,40,1607007117,1607007117
23,Closeup Super Fresh Tooth Paste,CloseUp,"For fresh breath all day and a smile that sparkles, get the Closeup Ever Fresh Red Hot Gel Toothpaste. It gives you 3x fresher breath and whiter teeth. The Active Zinc Mouthwash present in the toothpaste fights 99% of germs, and its micro shine crystals remove yellow film for whiter teeth. Feel the intense zest of the Red Hot flavour",xyz,1,4,40,1607007117,1607007117
24,Closeup Triple fresh,CloseUp,"For fresh breath all day and a smile that sparkles, get the Closeup Ever Fresh+ Red Hot Gel Toothpaste. It gives you 3x fresher breath and whiter teeth. The Active Zinc Mouthwash present in the toothpaste fights 99% of germs, and its micro shine crystals remove yellow film for whiter teeth. Feel the intense zest of the Red Hot flavour.",xyz,1,4,40,1607007117,1607007117
25,Dabur Tooth Powder danth manjan,Dabur,"Good health includes strong and healthy teeth. Give your teeth the best natural care with Dabur Lal Dant Manjan. An Ayurvedic product, Dabur Red Toothpowder gives you strong teeth and healthy gums.",xyz,1,4,40,1607007117,1607007117
26,Dabur Red Tooth Paste,Dabur,"Dabur Red Toothpaste is a unique blend of traditional Indian medicine and modern pharmaceutical technology that brings out the best of both. This toothpaste with its effective formulation is useful for maintaining oral hygiene, thus keeping your gums and teeth healthy.",xyz,1,4,40,1607007117,1607007117
27,Dabur Red Gel Tooth Paste,Dabur,"Say goodbye to bad mouth odour with Dabur Red Gel Toothpaste, a toothpaste that helps keep your teeth strong and breath odour free. This toothpaste from Dabur is specially made keeping in mind its use and safety. ",xyz,1,4,40,1607007117,1607007117
28,Dabur Herbal Clove Tooth Paste,Dabur,Say goodbye to bad mouth odor with Dabur Herbal Clove Toothpaste. It's enriched with the goodness of Clove that helps keep your teeth strong and keep your breath odor free.,xyz,1,4,40,1607007117,1607007117
29,Dabur Miswak Tooth Paste,Dabur,Dabur Meswak Toothpaste is formulated to give you strong teeth & healthy gums. It contains the goodness of herbal ingredients that strengthen gums and provides protective shield against cavity throughout the day. Brush your teeth twice with this toothpaste for better results,xyz,1,4,40,1607007117,1607007117
30,Dabur Babool,Dabur,"Packed with Dabur's age-old wisdom and 5 powerful Ayurvedic ingredients like Babool, Clove, Triphala, Pudina and Patchouli, Dabur Babool Ayurvedic Toothpaste gives your family all-round protection. Babool strengthen the teeth, cloves help to fight cavity-causing germs, triphala provides an antioxidant effect, mints help to freshen your breath, and patchouli reduces inflammation.",xyz,1,4,40,1607007117,1607007117
31,Ayush Whitne Tooth Paste,Lever Ayush,Ayush Whitening toothpaste is formulated with 5000 years of Ayurvedic wisdom to remove stains for whiter teeth. It contains the goodness of Rock Salt (Sendha Namak) & Arimedas Tailam. Rock Salt (Sendha Namak) is the healthiest form of salt in Ayurveda.,xyz,1,4,40,1607007117,1607007117
32,Ayush Anti Caviate Tooth Paste,Lever Ayush,Ayush Anti Cavity Clove Oil Toothpaste is formulated with more than five-thousand years of Ayurvedic wisdom to give you strong teeth & healthy gums. It contains the goodness of Clove Oil (Laung ka Tel) & Dasanakanthi Choornam which help you in maintaining good oral hygiene.,xyz,1,4,40,1607007117,1607007117
33,Sensodyne Fresh mint Tooth Paste,Sensodyne,Sensodyne Fresh Mint toothpaste works deep inside the tooth to soothe painful sensitivity and helps to keep the pain from coming back. It has a mild mint flavor that keeps your mouth feeling fresh and clean,xyz,1,4,40,1607007117,1607007117
34,Sensodyne Rapid relief Tooth Paste,Sensodyne,"Sensodyne Rapid Relief Toothpaste provides clinically proven rapid relief for sensitive teeth. It works in 60 seconds to relieve tooth sensitivity when directly applied to the gums with a fingertip. Sensodyne Rapid Relief has been formulated to create a physical seal against sensitivity triggers. When used twice daily, it provides long-lasting protection from sensitivity.",xyz,1,4,40,1607007117,1607007117
35,Sensodyne Fresh Repair & Protect Tooth Paste,Sensodyne,Sensodyne Repair & Protect Toothpaste is powered by NovaMin and is clinically proven to relieve tooth sensitivity. Its new enhanced formulation works to create a harder reparative layer over the vulnerable areas of your sensitive teeth to help you enjoy life without worrying about sensitivity.,xyz,1,4,40,1607007117,1607007117
36,Sensodyne whitening Tooth Paste,Sensodyne,"Say goodbye to bad mouth odour with Sensodyne Whitening Toothpaste, which helps keep your teeth strong and your breath odour-free. This helps to remove stains for a whiter, brighter smile while relieving sensitive teeth by building a protective barrier that blocks the sensitivity caused by hot, cold, sweet and other contact triggers.",xyz,1,4,40,1607007117,1607007117
37,Sensodyne Fresh Gel Tooth Paste,Sensodyne,"Say goodbye to bad mouth odour with Sensodyne Whitening Toothpaste, which helps keep your teeth strong and your breath odour-free. This helps to remove stains for a whiter, brighter smile while relieving sensitive teeth by building a protective barrier that blocks the sensitivity caused by hot, cold, sweet and other contact triggers.",xyz,1,4,40,1607007117,1607007117
38,Sensodyne Deep Clean Tooth Paste,Sensodyne,"Colgate Total Charcoal Deep Clean Toothpaste provides 12 hour germ fighting protection. It protects 100% of your mouth and keeps you away from bacteria and bad breath. It protects your teeth enamel, prevents cavities, tooth stains etc. Colgate is a well-known brand that offers effective dental and oral care.",xyz,1,4,40,1607007117,1607007117
39,Sensodyne  Fresh mint Tooth Paste,Sensodyne,Sensodyne Fresh Mint toothpaste works deep inside the tooth to soothe painful sensitivity and helps to keep the pain from coming back. It has a mild mint flavor that keeps your mouth feeling fresh and clean.,xyz,1,4,40,1607007117,1607007117
40,Sensodyne Herbal Multi care Tooth Paste,Sensodyne,"Try Sensodyne Herbal Multi Care Toothpaste for yourself and feel the difference it makes to sensitive teeth. It is specifically formulated to help protect against sensitivity, with regular brushing it will provide lasting protection.",xyz,1,4,40,1607007117,1607007117
41,Himalaya sparkling white Fresh Gel Tooth Paste,Himalaya,"Himalaya Sparkling White Fresh Gel is a breakthrough herbal formulation based on plant enzyme technology that gently removes surface stains on your teeth. It contains papain and bromelain, enzymes present in Papaya and Pineapple, which safely whiten teeth. 
long with that, cinnamon, clove with Menthol, have an anti-microbial property that helps fight odour-causing bacteria to give you a natural burst of refreshing long-lasting fresh breath for up to 12 hours.",xyz,1,4,40,1607007117,1607007117
42,Himalya complete Tooth Paste,Himalaya,"Himalaya Complete Care Toothpaste, with its rare selection of herbal ingredients, rich in anti-oxidants, has been specially developed to make teeth and gums strong. It consists of Toothache Tree, found in the valley of the subtropical Himalayas, which is excellent in healing bleeding gums. This Lemon-scented tree has been used in home remedies around the world to relieve toothaches. Neem and Pomegranate in the toothpaste fight germs and give your teeth all-day protection.",xyz,1,4,40,1607007117,1607007117
43,Himayala sensitive Tooth Paste,Himalaya,"Sensitive Toothpaste, Relief from sensitive teeth, What it does - Himalayas Sensitive Toothpaste is a herbal formulation that gives you rapid and lasting relief from tooth sensitivity. It contains Spinach, which blocks exposed dentinal tubules that are sources of teeth sensitivity. Almond Shell extract is an excellent astringent, and Menthol helps maintain long-lasting fresh breath.",xyz,1,4,40,1607007117,1607007117
44,Pepsodent Germ Check Tooth Paste,Pepsodent,"Restore your bright and healthy smile everyday with the Pepsodent Germicheck+ Cavity Protection Toothpaste. Keep your teeth white and shining all day long while it also helps you fight unwanted dental problems like tartar build up and plaque formation. Enriched with the goodness of Fluoride and Germicheck+ formula, it keeps your teeth and gums healthy. Regular use of the toothpaste gives you stronger and shinier teeth.",xyz,1,4,40,1607007117,1607007117
45,Pepsodent Lavanga & Salt Tooth Paste,Pepsodent,"Let this toothpaste take charge of your oral health. The new Pepsodent Clove and Salt Toothpaste comes with the essential goodness of two core components. It has clove oil that is known to help prevent toothaches and fight tooth decay and salt which can help prevent gums problems. Plus, this toothpaste has superior germ attack power that helps fight cavity-causing germs even hours after brushing! Be confident of a strong and healthy smile.",xyz,1,4,40,1607007117,1607007117
46,Pepsodent 2 in 1 Tooth Paste,Pepsodent,"Get pearly white teeth with this Pepsodent 2 in 1 Toothpaste. Its specially designed formula helps fight tooth cavities and decay, while the protective elements in this toothpaste helps prevent plaque formation and gum sensitivity. With a fresh flavor, the toothpaste gives an everlasting fresh and clean breath. Regular use of this toothpaste results in lesser bacteria and germ formation. So dont worry about indulging in your favorite foods ever again! Pepsodent 2 in 1 cavity protection is a quality product of Unilever Dental Research.",xyz,1,4,40,1607007117,1607007117
47,Pepsodent Whitening Tooth Paste,Pepsodent,"Pepsodent Whitening Toothpaste contain a proven cavity fighting formula that helps eliminate plaque and is especially formulated to assist get your teeth their whitest. Best of all, it supplies complete guard for strong enamel and healthy gums.",xyz,1,4,40,1607007117,1607007117
48,Pepsodent Clove Tooth Paste,Pepsodent,"Let this toothpaste take charge of your oral health. The new Pepsodent Clove and Salt Toothpaste comes with the essential goodness of two core components. It has clove oil that is known to help prevent toothaches and fight tooth decay and salt which can help prevent gums problems. Plus, this toothpaste has superior germ attack power that helps fight cavity-causing germs even hours after Brushing! Be confident of a strong and healthy smile, buy the Pepsodent Clove and Salt Toothpaste, right away!",xyz,1,4,40,1607007117,1607007117
