921,Hema Pooja Agarbatti Mogra,Hema,"They are made by creating the best mixture of essential oils, barks, flowers, resins and they are worked into a tar like roll, or they are just blended together. The combination of all these creates an amazing and pleasant aromatic smell offering you the best experience for all your purposes.",xyz,1,2,35,1607007117,1607007117
922,Hema Pooja Agarbatti Chandan,Hema,"They are made by creating the best mixture of essential oils, barks, flowers, resins and they are worked into a tar like roll, or they are just blended together. The combination of all these creates an amazing and pleasant aromatic smell offering you the best experience for all your purposes.",xyz,1,2,35,1607007117,1607007117
923,Hema Pooja Agarbatti Musk,Hema,"Handmade according to the ancient tradition of india. The holy mart incense sticks uses only the finest herbs, gums, essential oils, charcoal and other pure and natural ingredients. The holy mart's line of incense is known for its long lasting burn time, as well as a greater fragrance throughout the entire burn. 3 packs of 180 musk incence sticks by the holy mart agarbatti stick| puja musk dhoop sticks",xyz,1,2,35,1607007117,1607007117
924,Riya Pooja Agarbatti Champa,Riya,"Champa Agarbatti releases a divine fragrance with a soft and spicy sweetness, turning your home into a soothing oasis. The breezy floral hint with a dash of exotic and oriental fragrance evokes love and romance. The sensuality of the scent mellows down, leaving one with an intimate and mollified mind. ",xyz,1,2,35,1607007117,1607007117
925,Riya Pooja Agarbatti swasti,Riya,"Riya AARIA CLASSICALLY BLENDED SANDAL, SUFALAM, ROSE, JASMINE PREMIUM INCENSE STICKS",xyz,1,2,35,1607007117,1607007117
926,Riya Pooja Agarbatti AARIA LAVENDER,Riya,"Riya AARIA CLASSICALLY BLENDED SANDAL, SUFALAM, ROSE, JASMINE PREMIUM INCENSE STICKS",xyz,1,2,35,1607007117,1607007117
927,Riya Pooja Agarbatti AARIA ROSE,Riya,"Riya AARIA CLASSICALLY BLENDED SANDAL, SUFALAM, ROSE, JASMINE PREMIUM INCENSE STICKS",xyz,1,2,35,1607007117,1607007117
928,Riya Pooja Agarbatti AARIA JASMINE,Riya,"Riya AARIA CLASSICALLY BLENDED SANDAL, SUFALAM, ROSE, JASMINE PREMIUM INCENSE STICKS",xyz,1,2,35,1607007117,1607007117
929,Patanjali Pooja Agarbatti  Aasta Patchouli,Patanjali,PATANJALI AASTHA POOJA PRODUCTS ARE MADE FROM BEST QUALITY INGREDIENTS &AIMED AT CREATING A DIVINE ATMOSPHERE. IT HELPS THE CONNECTION BETWEEN AATMA (INNER SOUL) & PARMATMA (ALMIGHTY GOD) INTACT,xyz,1,2,35,1607007117,1607007117
930,Patanjali Pooja Agarbatti  Aastha Kewda,Patanjali,"This agarbatti can be used both in houses and offices. It made up of good quality material. Add a new look to your pooja room or where ever you place. Incense sticks are a common tradition within many cultures, religions and regions. They are also associated with prayer, worship, and healing, and come in a variety of traditional scents.",xyz,1,2,35,1607007117,1607007117
931,Siddhi Pooja Agarbatti  Sandalam,Siddhi,"These Incense Sticks comes in a Pack of 3. It ocntains Gulabari, Blessing, Sandalam variants.

",xyz,1,2,35,1607007117,1607007117
932,Siddhi Pooja Agarbatti Belpatra,Siddhi,"These Incense Sticks comes in a Pack of 3. It ocntains Gulabari, Blessing, Sandalam variants.

",xyz,1,2,35,1607007117,1607007117
933,Siddhi Pooja Agarbatti Blessing,Siddhi,"These Incense Sticks comes in a Pack of 3. It ocntains Gulabari, Blessing, Sandalam variants.

",xyz,1,2,35,1607007117,1607007117
934,Moksha Pooja Agarbatti Swarna Lavender,Moksha,The fragrance of Moksh Swarna Lavender Agarbatti will take you to a creative world of the exotic aroma of garden fresh French lavender flowers. This gentle aroma of these small purple flowers is packed in a single packet of Swarna Lavender Agarbatti.,xyz,1,2,35,1607007117,1607007117
935,Mysore Sandal Pooja Agarbatti Sir M.V. 100,Mysore Sandal,Package Contents: 10 Packs of Incense Sticks . Dimensions (L x W x H): 9 cm x 1.5 cm x 24 cm .,xyz,1,2,35,1607007117,1607007117
936,Mysore Sandal  Pooja Agarbatti incensive stics,Mysore Sandal,Hand dipped Mysore Sandal fragrance Incense sticks. We make incense sticks by following a unique dipping process where we dip Agarbatti for more than a couple of hours and then let them dry naturally for few days. The result is you get premium smelling incense sticks that are as pure as your pooja or meditation.,xyz,1,2,35,1607007117,1607007117
937,Mysore Sandal Pooja Agarbatti,Mysore Sandal,"Lighting of incense is a major Hindu tradition that has been in existence through ages.During Puja we say 'Dhupam Aghrapayami' while waving Dhupa(incense) before God. Its one of the 16 upacharas(Shodasha Upacharas) as well as one among the 5 Upacharas(Pancha Upacharas).So,an important Upachara, not to be missed.",xyz,1,2,35,1607007117,1607007117
938,Mysore Sandal Pooja Agarbatti Rose,Mysore Sandal,"Being one of the well-distinguished companies in the market, we are involved in offering Rose Incense Stick.",xyz,1,2,35,1607007117,1607007117
939,Mysore Sandal Pooja Agarbatti Mystic,Mysore Sandal,It has soothing fragrance and long burning life. It does not cause smoke,xyz,1,2,35,1607007117,1607007117
940,Black Stone Sandal Pooja Agarbatti Mystic,Zed Block,Black Stone is a superior fragrance that is unique with a contemporary flair.,xyz,1,2,35,1607007117,1607007117
941,Zed Block Pooja Agarbatti premium incense Sticks 3 in 1,Zed Block,"Made From Natural Herbal Products, Zed Black Scented Sticks Assure Long-Lasting And Mesmerizing Aroma That Will Undoubtedly Add More To The Aura Of A Room. Natural Fragrance Sticks Make The Environment Free From Negative Energy. Zed Black incense sticks pack is Specifically Designed for Providing Enthralling Aroma That Can Soothe the Environment and Boost the Positive Energy.",xyz,1,2,35,1607007117,1607007117
942,Zed Block Pooja Agarbatti Chandan,Zed Block,"This Is Hand Made Masala Agarbatti which is aromatic biotic material that releases fragrant smoke when burned. The term is used for either the material or the aroma. Incense is used for aesthetic reasons, aromatherapy, meditation, and ceremony.",xyz,1,2,35,1607007117,1607007117
943,Zed Block Pooja Agarbatti Kasturi,Zed Block,"Zed Black is one of the largest agarbatti manufacturing brands in India, believes in the Mission-To provide highest quality products to consumer and create value for all stakeholders. The brand 'Zed Black' stands for quality products. Zed Black is one of the leading manufacturers in India. Zed Black is the manufacturer of wide range of agarbatti, dhoopbatti, dhoop cones, dhoop sticks, and hawan samagri.",xyz,1,2,35,1607007117,1607007117
944,Zed Block Pooja Agarbatti Pure Sandal,Zed Block,"Crafted natural herbal products, Zed Black scented sticks assure continuing and compelling aroma that will undoubtedly add more to the atmosphere of a room. Natural fragrance sticks make the atmosphere free from negative energy.",xyz,1,2,35,1607007117,1607007117
945,Zed Block Pooja Agarbatti fresh pineapple,Zed Block,Zed Black offers the Luxury Premium Pineapple Dhoop Cones that assures long-lasting and mesmerizing aroma that will undoubtedly add more to the aura of a room. These Dhoop Cones make the environment positive provides peace of mind.,xyz,1,2,35,1607007117,1607007117
946,Zed Block Pooja Agarbatti sigma,Zed Block,"Indulge everyone in the devotional and mollifying odors of Zed Black incense sticks available in five variant fragrances: Sigma, Attar Rajnigandha, Manthan Gold, Attar Phool and Deep Gulab. Made from pure herbs and exotic flowers, it appeases the complete environment, either it is at home or an office. With quality packing, these sticks produce an enduring fragrance.",xyz,1,2,35,1607007117,1607007117
947,Zed Block Pooja Agarbatti Gulab,Zed Block,The product is made up of bamboo and is black in color.,xyz,1,2,35,1607007117,1607007117
948,Zed Block Shriphal Sambhrani,Zed Block,This highly effective and best quality Shriphal Sambrani incense cone is used specifically for spiritual purpose. Its charming fragrance fights with the negative energy and contributes a lot in creating a thoughtful and positive aura. This aroma incense cone is made from herbal products. Use these incense cones for spiritual purpose or while meditating and exercising.,xyz,1,2,35,1607007117,1607007117
949,Shiv Shakti Pooja Agarbatti,Shiv Shakti,"Shiva is the third diety of Hindu triad of great gods, others being Brahma and Vishnu. Shiva is often referred to as the Destroyer, but it might be better to think of him as God of Transformation, since he is often associated with creation which comes out of destruction.",xyz,1,2,35,1607007117,1607007117
950,Mitra Loban,Mitra,"Dhoop's are another masala sub-group. They are an extruded incense, lacking a core bamboo stick. Many dhoop's have very concentrated scents and put out a lot of smoke when burned.
The oldest source on dhoop is the Vedas, specifically, the Atharva-veda and the Rigveda. Dhoop-burning was used both to create pleasing aromas and a medicinal tool. Its use in medicine is considered the first phase of Ayurveda, which uses dhoop as an approach to healing. Dhoop-making was thus almost exclusively done by monks.",xyz,1,2,35,1607007117,1607007117
951,Mitra Singapore sambrani Powder,Mitra,Singapore Loban cup dhoop is made of pure and natural loban to give a rejuvenating religious experience. It is advisable to burn the cup sambrani on a metal or earthen base. It is ideal for pooja and prayer. Singapore Loban can also be used as a mosquito repellent.,xyz,1,2,35,1607007117,1607007117
952,Mitra Globe Singapore Loban,Mitra,Singapore Loban cup dhoop is made of pure and natural loban to give a rejuvenating religious experience. It is advisable to burn the cup sambrani on a metal or earthen base. It is ideal for pooja and prayer. Singapore Loban can also be used as a mosquito repellent.,xyz,1,2,35,1607007117,1607007117
953,Sambrani Powder,Swastik,"It is also called loban Dhoop.2) It is the finest energy purifier of atmosphere.Using loban dhoop fumes is a traditional and spiritual secret in India to uplift the energy level. 3) It has been used for centuries by saints and kings. Benzoin is often used in religious ceremonies, and is considered to have a great influence on cleansing and unblocking the human body energy centers/meridians. 4) It is antiseptic, and is wonderful for cleansing, whether you wish to clear a room or simply for cleansing your aura. It is said that benzoin helps bring inspiration and creativity.Benzoin can help attract love, provide psychic protection, wisdom, aids the memory, and helps ease depression. 5) It is also often used in prosperity spells. Uses: While performing puja burn a Dhoop and offer to deity, upon the completion of puja take dhoop on you and spread it in the entire house.It removes all negative energies that surround you.It is also a pure, good and natural pest repellant.",xyz,1,2,35,1607007117,1607007117
954,Camphors,Swastik,"or purity that speaks for itself, it's in harmony with your devotion. Pure camphor symbolizes union with God as it burns completely. It dispels negativity, keeps one healthy and attracts prosperity, just like 100% pure Mangalam camphor.",xyz,1,4,35,1607007117,1607007117
955,swastik Raw Camphor,Swastik,"Ambica Shakti Pure Camphor Block is a waxy, transparent solid with a strong, fragrant odour. It is broadly used in hindu religious ceremonies, for aarti that leaves behind a faint scent and is also believed to ward off negative energy.",xyz,1,4,35,1607007117,1607007117
956,Gopuram Pure Haldi  Kumkum (Roli),Gopuram,"Kumkum is most often applied by Hindus to the forehead. The reason for this particular location has to do with the ancient Hindu belief that ""the human body is divided into seven vortices of energy, called chakras, beginning at the base of the spine and ending at the top of the head. The sixth chakra, also known as the third eye, is centered in the forehead directly between the eyebrows and is believed to be the channel through which humankind opens spiritually to the Divine"". Thus the kumkum is placed at the location of the body which is believed by Hindus to be the most holy we BNsons offer MANGALYA/THAALI COTTON THREAD/KAYIRU with every purchase of pooja items",xyz,1,1,35,1607007117,1607007117
957,Gopuram Kumkum,Gopuram,??Gopuram Kumkum /Sindoor Powder??,xyz,1,1,35,1607007117,1607007117
958,Gpuram Haldi Powder,Gopuram,"This GOPURAM TURMERIC powder is good and use for our skin usually while face wash this turmeric powder is applied in our face with sufficient water, after 2 to 5 minutes wash with water, it helps and prevent from various kind of skin allergy, disease",xyz,1,1,35,1607007117,1607007117
959,Charminar Maroon Kumkum,Charminar,"Charminar Maroon Kumkum is traditionally made from Pure Haldi (turmeric) (pasupu). It is free from harmful colour, chemicals and oils. It is 100% safe to apply on skin. It is also used in KAILASH GOWRI NOMU POOJAS. CHARMINAR PURE MAROON KUMKUM is the best choice for nomu pooja.",xyz,1,1,35,1607007117,1607007117
960,Charminar Red Kumkum,Charminar,"Charminar Pure Kumkum is traditionally made from pure turmeric (Haldi) (Paspu). It is 100% natural. It is free from harmful colours,chemicals and oils.It is 100% safe to apply on skin.",xyz,1,1,35,1607007117,1607007117
961,Srisailam Deepam Cotton Wicks/ Vattulu,Srisailam,"The wicks are favorite to all gods. In pooja you can perform pooja by lightning with one lakh wicks, crore wicks. By doing this family and life grow gradually.",xyz,1,1,35,1607007117,1607007117
962,Srisailam Deepam Flower Wicks/ Vattulu,Srisailam,Cotton bati diya/diya batti for puja/ghee batti for pooja/batti in pooja/ghee jyot batti/jot batti for pooja/jyot batti packs ( pack of 201 pcs) By Dorvik EnterprisesSmokeless Wicks Cotton Wicks Pooja Wicks Puja Wicks Hybrid Cotton Wicks wicks for pooja wicks for oil lamps diya batti ghee wick wicks cotton floating oil wicks floating wicks for oil lamp batti for diya batti cotton pooja batti cotton bati diya diya batti for puja ghee batti for pooja batti in pooja ghee jyot batti jot batti for pooja jyot batti packs batti oil batti pooja batti puja batti wicks om phool batti cotton phool batti cotton batti for puja pooja batti cotton cotton diya batti cotton deepam batti pooja batti cotton with ghee cotton gol batti jot batti cotton cotton ki battipuja batti with ghee cotton for puja batti dhoop batti for puja diya batti for puja cotton batti for puja puja bati deepak ghee diya batti for puja ghee batti for puja puja ghee jyot batti rui batti for puja jyot batti packs jot batti for pooja jot batti cotton akhand jyot batti ghee jyot batti puja ghee jyot batti radha madhav ghee jyot batti rui batti for puja rui ki batti,xyz,1,1,35,1607007117,1607007117
963,Cotton Thread Big,General,"The candle wick thread is made of cotton, high quality and durable 100 gram. Practical: The candle wick thread is very useful and must have for homemade candle. Eco-friendly: This candle wick is eco-friendly and contains no harmful substance. Can be cut: This roll of candle wick can be cut to meet your different sizes needs. Use: This wick Thread is used for candle making like decorative candle, pillar candle, plain candle, church candle etc.. you can use this in paraffin wax, gel wax, soy wax, bees wax. Krokio Pack of 100 Pieces Metal Candle Wick Sustainers / Wick Tabs / Base DIY Candle Making / Candle Craft For Candle Making, Piller Candle Making, Tea Light Candle Making - Silver 1x1x0.5 cm",xyz,1,1,35,1607007117,1607007117
964,Gandham,General,"Sandalwood is a class of woods from trees in the genus Santalum. The woods are heavy, yellow, and fine-grained, and, unlike many other aromatic woods, they retain their fragrance for decades.",xyz,1,1,35,1607007117,1607007117
965,Pooja Oil Deeparadhna,Sreeja,"Deeparadhana oil, which can be used in your home for pooja purposes.",xyz,1,3,35,1607007117,1607007117
966,Mangalmai Pooja Oil,Mangalmai,Mangalmai Pooja oil is the wonderful oil for your lamp. It has a great aroma as well. Not just on a daily basis,xyz,1,3,35,1607007117,1607007117
967,Omshanthi Pooja Oil,Omshanti,Om Shanthi Pure Puja Oil the blend of five puja oils are sourced in their purest form and blended with Jasmine or Parijata fragrance for cherished memories to last longer. Lighted Diya induces positive visual ambience and alerts our subconscious mind. This sharpens our receptive skills. Memories made at such moments are better retained. Diya is lighted at the beginning of every activity to make it auspicious and help us remember and cherish the moment.,xyz,1,3,35,1607007117,1607007117
968,Vijaya Deepam Oil,Vijaya,"Hinduism and many other faiths across the world recommend the use of lamps and light in prayers. The light symbolises the absence of darkness, grief and sorrows. The Oil Lamp, Diya, Deepa or Deepam is lit to bow down to knowledge and remove darkness from our homes. It is customary to light a lamp before starting any auspicious event or ceremony and is a constant fixture in the ""Pooja"" or holy room in every home in India. By lighting lamps, the glow of the almighty is said to spread all over one's home and is an invitation to the gods to visit our homes.",xyz,1,3,35,1607007117,1607007117
969,VVD POOJA OIL PANCHA MANGAL DEEP ,VVD,"Veda oil is the wonderful oil for your lamp. It has a great aroma as well. Not just on a daily basis, but the belief of lighting a lamp also extends to favorable occasions and functions, be it spiritual or social. Lighting a lamp stands for driving away that night. The wick is most important object which is using to light an oil lamp and in fact wick is a sign of power and brightness where a lamp emits lighting.",xyz,1,3,35,1607007117,1607007117
970,Gillete Vector3 1 handle 1 blade,Gillette,"Gillette Vector-3 Razor has 3 self-adjusting blades, non-slip rubber grip and an easy to rinse and clean blades, giving an extremely close and fast shave compared to your current double edge blade.",xyz,1,4,46,1607007117,1607007117
971,Gillete Mach3 1 razor + 1 shaving Catridge,Gillette,"Gillette mach3 men's razor blade refills feature stronger-than-steel blades that stay sharper longer. With sharper blades, it is engineered to last for 15 comfortable shaves. These Gillette razors feature a lubrication strip that glides to help protect your skin from redness and a micro fin skin guard that stretches the skin and prepares hair to be cut. Mach3 men's razor blade refills fit all mach3 razors. Gillette mach3 gives a better shave than a new 2-bladed ordinary razor even after 5 weeks.",xyz,1,4,46,1607007117,1607007117
972,Gillete Fusion 1razor + 1 catridge,Gillette,"Gillette Fusion Power Box of four replacement cartridges for the Gillette Fusion razor. Compatible with all Fusion razor handles. 5 Blade shaving surface + 1 Precision trimmer for a comfortable, precise shave. Blades are spaced 30% closer together than MACH3 blades to help reduce pressure with more comfort and less irritation than MACH 3, you barely feel the blades.",xyz,1,4,46,1607007117,1607007117
973,Giellette 7'o clock P II,Gillette,"The Gillette 7 'o' Clock PII cartridge pack of 5 pieces comes with international trac II technology to make shaving even more pleasurable for you, day after day. The twin blades provide a clean, close shave. Added comfort from razor burns with the unique Gillette lubrastrip technology that also allows easy gliding across your skin. The easy-loading system makes changing blades fast and easy.",xyz,1,4,46,1607007117,1607007117
974,Giellette 7'o clock Sterling 1 razor with 1 super blade,Gillette,"he 7 O'Clock Sterling Razor is made to exacting standards to give you a premium shave.Its durable metal parts hold the blade at the perfect angle to the face. This critical angle, and the platinum blade, combine make your shaves smooth and comfortable, day after day.",xyz,1,4,46,1607007117,1607007117
975,Giellette 7'o clock Permasharp Stainless 1 razor with 2 blades,Gillette,"The razor's snap-action makes shaving really convenient and hassle - free. Unlike ordinary razors, its supwrior design ensures afilm hold and precise positioning of the blade, minimising any chainces of nicks and cuts. So you can have a shave that's totally safe and comfortable.",xyz,1,4,46,1607007117,1607007117
976,Giellette 7'o clock Super platinum 1 razor with 2 blades,Gillette,"The Original Gillette 7 O Clock Continues Its Legacy Of Close Shaves. It Offers A Comfortable Shave, Along With The Longevity That Comes Only With Exchangeable Blades. Its Comfort Guard Bring You A Close, Comfortable Shave To Show When You Are No Longer Getting An Optimal Shave From Your Razor Blade.",xyz,1,4,46,1607007117,1607007117
977,Gillete Mach3 1 handle + 1 shaving Catridge,Gillette,he razor that raised the blade count to three,xyz,1,4,46,1607007117,1607007117
978,Gillete Mach3 1 Razor + 1 shaving Cream ( 50 gms),Gillette,"Gillette mach3 men's razor blade refills feature stronger-than-steel blades that stay sharper longer. With sharper blades, it is engineered to last for 15 comfortable shaves. These Gillette razors feature a lubrication strip that glides to help protect your skin from redness and a micro fin skin guard that stretches the skin and prepares hair to be cut. Mach3 men's razor blade refills fit all mach3 razors. Gillette mach3 gives a better shave than a new 2-bladed ordinary razor even after 5 weeks.",xyz,1,4,46,1607007117,1607007117
979,Gillete Mach3 Turbo Plus 1 Razor + 1 shaving Catridge,Gillette,"Gillette mach3 men's razor blade refills feature stronger-than-steel blades that stay sharper longer. With sharper blades, it is engineered to last for 15 comfortable shaves. These Gillette razors feature a lubrication strip that glides to help protect your skin from redness and a micro fin skin guard that stretches the skin and prepares hair to be cut. Mach3 men's razor blade refills fit all mach3 razors. Gillette mach3 gives a better shave than a new 2-bladed ordinary razor even after 5 weeks.",xyz,1,4,46,1607007117,1607007117
980,Gillette Vector Plus razor,Gillette,Gillette Vector Razor with adjust automatically pivoting head fast twin blades shave you twice with each stroke eliminating irritating repeat strokes for a faster shave than with a double edge blade.,xyz,1,4,46,1607007117,1607007117
981,Gillette Skinguard sensitive 1 Handle + 1 catridge,Gillette,The new Gillette Skin guard is a revolutionary razor that is designed for any man who loves his skin. This 2-bladed razor has a unique Skin guard technology that minimizes contact between the blades and your face. It is the first Gillette razor in India with double lubrastrips that leave your skin feeling smooth after the shave. So experience the new Gillette Skin guard today- for a shave that your skin will love.,xyz,1,4,46,1607007117,1607007117
982,Gilette Vector 3 Fast shave 2 catridges,Gillette,Gillette Vector-3 blades adjust automatically to the contour of your skin. Triple blades shave you thrice with each stroke eliminating irritating repeat strokes for a faster shave than with a double edge blade.,xyz,1,4,46,1607007117,1607007117
983,Gilette Match 3 sensitive Fast shave 2 catridges,Gillette,"These featured blades delivers less pressure on the skin, along with an enhanced Lubra strip with Aloe Vera that delivers better lubrication, so men can now experience an exceptionally close shave with less skin irritation even on the most sensitive areas of their face New Gillette Mach3 Sensitive includes a range of features designed to enhance comfort and reduce irritation while shaving.;Three progressively aligned blades deliver less pressure on the skin, while each blade shaves the hair progressively closer.",xyz,1,4,46,1607007117,1607007117
984,Gilette Match 3 Turboe 2 catridges,Gillette,"The three blades of the Gillette MACH3 Turbo are treated with an Advanced Anti-Friction Coating, allowing the MACH3 Turbo to remove each hair with less irritation. Soft, protective Microfins gently smooth down the skin, allowing the MACH3 Turbo to shave evenly and effortlessly. The Indicator Lubrication Strip ensures that your MACH3 Turbo razor blade keeps gliding across your skin, shave after shave.",xyz,1,4,46,1607007117,1607007117
985,Gillette Fusion 5 2 Catridges,Gillette,"Gillette Fusion5 ProGlide razors for men feature 5 anti-friction blades. With FlexBall technology, ProGlide responds to contours and gets virtually every hair. The Precision Trimmer on the back is great for hard-to-reach areas such as under the nose and sideburns. One men's razor blade refill equals up to one month of shaves. Fusion5 Proglide men's razor fits all Fusion5 blade refills. Gillette razors, formerly called Fusion ProGlide.",xyz,1,4,46,1607007117,1607007117
986,Gillette Skinguard sensitive 2 Catridges,Gillette,The new Gillette Skin guard is a revolutionary razor that is designed for any man who loves his skin. This 2-bladed razor has a unique Skin guard technology that minimizes contact between the blades and your face. It is the first Gillette razor in India with double lubrastrips that leave your skin feeling smooth after the shave. So experience the new Gillette Skin guard today- for a shave that your skin will love.,xyz,1,4,46,1607007117,1607007117
987,Gillette Mach 3 4N Catridges,Gillette,"It's time to upgrade your shaving experience with Gillette Mach3 Turbo Shaving 3 Blades Cartridge that delivers a closer shave without causing irritation. This has turbo cutting blades that give you an easy, superior and comfortable shaving with less tug and pull. So what are you waiting for? Buy the product online at the best rate, right here!",xyz,1,4,46,1607007117,1607007117
